{
  "schemaVersion": "0.2.0",
  "updatedAt": "2026-07-12",
  "product": {
    "name": "Business Control",
    "subtitle": "Local-first control plane for repo-backed businesses"
  },
  "businesses": [
    {
      "id": "app-name",
      "name": "App Name",
      "type": "IOS launch",
      "updated": "2026-07-12",
      "badge": "Concept",
      "mark": "AN",
      "subtitle": "One-sentence promise still to be defined.",
      "metrics": [
        {
          "label": "Stage",
          "value": "Concept",
          "note": "concept"
        },
        {
          "label": "Lanes",
          "value": "0/22",
          "note": "0 blocked"
        },
        {
          "label": "Artifacts",
          "value": "57",
          "note": "evidence refs"
        },
        {
          "label": "Risk",
          "value": "1",
          "note": "blockers + drift + cards"
        }
      ],
      "readiness": [
        {
          "status": "amber",
          "label": "Continuity state reviewed",
          "tag": "Needed"
        },
        {
          "status": "amber",
          "label": "Git status reviewed before work",
          "tag": "Needed"
        },
        {
          "status": "amber",
          "label": "Orchestration preflight",
          "tag": "Needed"
        },
        {
          "status": "amber",
          "label": "Design Room render",
          "tag": "Not Started"
        },
        {
          "status": "amber",
          "label": "Compound Engineering route",
          "tag": "Not Evaluated"
        }
      ],
      "agents": [
        {
          "id": "operator.orchestrator",
          "name": "Orchestrator",
          "kind": "agent",
          "summary": "Owns integration through orchestrator and reconstructs state from AGENTS.md, state/PROJECT_STATE.yaml, state/launch-cockpit.html, operations/BUSINESS_ACCESS.md."
        },
        {
          "id": "operator.product-leader",
          "name": "Product Leader",
          "kind": "agent",
          "summary": "Audits 22 launch lanes and keeps product, activation, and retention decisions tied to evidence."
        },
        {
          "id": "operator.design-guru",
          "name": "Design Guru",
          "kind": "agent",
          "summary": "Audits studio/seed/business.json, studio/seed/theme.tokens.json and rendered Design Room proof."
        },
        {
          "id": "operator.engineering-leader",
          "name": "Engineering Leader",
          "kind": "agent",
          "summary": "Owns build and provider proof while surfacing 0 blocked launch lane(s)."
        }
      ],
      "lanes": [
        {
          "id": "panel.design-room",
          "title": "Design Room",
          "summary": "Design Room is Active and reads studio/seed/business.json, studio/seed/theme.tokens.json.",
          "path": "design/design-room.html",
          "status": "Ready"
        },
        {
          "id": "panel.agent-ops",
          "title": "Agent Operations",
          "summary": "Agent Operations is Planned and reads state/PROJECT_STATE.yaml, operations/AGENT_OPERATIONS.md, operations/agent-operations.json.",
          "path": "state/launch-cockpit.html",
          "status": "Draft"
        },
        {
          "id": "panel.operator-bootstrap",
          "title": "Founder-Zero Operator Bootstrap",
          "summary": "Founder-Zero Operator Bootstrap is Planned and reads state/PROJECT_STATE.yaml, operations/BUSINESS_ACCESS.md, operations/business-access.json, SECRETS.md.",
          "path": "state/launch-cockpit.html",
          "status": "Draft"
        },
        {
          "id": "panel.analytics",
          "title": "Analytics",
          "summary": "Analytics is Planned and reads state/PROJECT_STATE.yaml, analytics/ANALYTICS.md, analytics/analytics-plan.html.",
          "path": "analytics/analytics-plan.html",
          "status": "Draft"
        },
        {
          "id": "panel.monetization",
          "title": "Monetization",
          "summary": "Monetization is Planned and reads state/PROJECT_STATE.yaml, revenue/REVENUE_OPS.md.",
          "path": "revenue-plan.html",
          "status": "Draft"
        },
        {
          "id": "panel.store-ops",
          "title": "Store Ops",
          "summary": "Store Ops is Planned and reads state/PROJECT_STATE.yaml, APP_STORE_LISTING.md, store/STORE_CONSOLE.md, SCREENSHOTS.md.",
          "path": "app-store-listing.html",
          "status": "Draft"
        },
        {
          "id": "panel.growth",
          "title": "Growth",
          "summary": "Growth is Planned and reads state/PROJECT_STATE.yaml, growth/PAID_UA.md, growth/VIRAL_GROWTH.md.",
          "path": "growth-plan.html",
          "status": "Draft"
        },
        {
          "id": "view.launch-cockpit",
          "title": "Launch Cockpit",
          "summary": "0 launch lane(s) done, 0 blocked, 22 tracked.",
          "path": "state/launch-cockpit.html",
          "status": "Watch"
        },
        {
          "id": "view.continuity",
          "title": "Continuity",
          "summary": "Reconstruct state from the continuity source files before choosing work.",
          "path": "state/PROJECT_STATE.yaml",
          "status": "Gate"
        },
        {
          "id": "view.failure-cards",
          "title": "Failure Cards",
          "summary": "1 active failure card(s) tracked for future agents.",
          "path": "operations/FAILURE_CARDS.md",
          "status": "Active"
        }
      ]
    }
  ],
  "templates": [
    {
      "name": "B2C Mobile Launch",
      "summary": "Design Room, Launch Cockpit, App Store Ops, RevenueCat, PostHog, onboarding, retention, and failure-card evals.",
      "included": [
        "AGENTS.md",
        "CLAUDE.md",
        "Evals"
      ]
    },
    {
      "name": "Business Control Plane",
      "summary": "Top-level portfolio, business drill-downs, artifact registry, agent routing, source-of-truth docs, and runtime sync.",
      "included": [
        "Workspace",
        "Adapters",
        "Schemas"
      ]
    },
    {
      "name": "Commerce Growth",
      "summary": "Offer pages, pricing parity, subscription gates, Android/iOS releases, analytics, and Cloudflare deploy proof.",
      "included": [
        "Pricing",
        "Revenue",
        "Deploy"
      ]
    },
    {
      "name": "Workspace Platform",
      "summary": "Public/private route separation, tenant business routes, artifact storage, security checks, and local sync.",
      "included": [
        "Routes",
        "Artifacts",
        "Security"
      ]
    },
    {
      "name": "Personal Brand Funnel",
      "summary": "Offer architecture, multilingual SEO/GEO, content pillars, lead capture, and private ICP docs.",
      "included": [
        "Offers",
        "SEO",
        "ICP"
      ]
    },
    {
      "name": "AI App Audit",
      "summary": "Target-user walkthroughs, native build proof, onboarding issues, paywall checks, and release follow-through.",
      "included": [
        "Audit",
        "Build",
        "Proof"
      ]
    }
  ]
}
